<?xml version="1.0" encoding="UTF-8"?>
<tns:R3Reservedlist Name="" xmlns:tns="http://release3.com/FormsKeywords" xmlns:xsi="http://www.w3.org/2001/XMLSchema-instance" xsi:schemaLocation="http://release3.com/FormsKeywords FormsKeywords.xsd ">
  <Keyword Name=""/>
  
  <Keyword Name="ACCESS">

</Keyword>
<Keyword Name="ACCOUNT">

</Keyword>
<Keyword Name="ACTIVATE">

</Keyword>
<Keyword Name="ADD">

</Keyword>
<Keyword Name="ADMIN">

</Keyword>
<Keyword Name="ADVISE">

</Keyword>
<Keyword Name="AFTER">

</Keyword>
<Keyword Name="ALL">

</Keyword>
<Keyword Name="ALL_ROWS">

</Keyword>
<Keyword Name="ALLOCATE">

</Keyword>
<Keyword Name="ALTER">

</Keyword>
<Keyword Name="ANALYZE">

</Keyword>
<Keyword Name="AND">

</Keyword>
<Keyword Name="ANY">

</Keyword>
<Keyword Name="ARCHIVE">

</Keyword>
<Keyword Name="ARCHIVELOG">

</Keyword>
<Keyword Name="ARRAY">

</Keyword>
<Keyword Name="AS">

</Keyword>
<Keyword Name="ASC">

</Keyword>
<Keyword Name="AT">

</Keyword>
<Keyword Name="AUDIT">

</Keyword>
<Keyword Name="AUTHENTICATED">

</Keyword>
<Keyword Name="AUTHORIZATION">

</Keyword>
<Keyword Name="AUTOEXTEND">

</Keyword>
<Keyword Name="AUTOMATIC">

</Keyword>
<Keyword Name="BACKUP">

</Keyword>
<Keyword Name="BECOME">

</Keyword>
<Keyword Name="BEFORE">

</Keyword>
<Keyword Name="BEGIN">

</Keyword>
<Keyword Name="BETWEEN">

</Keyword>
<Keyword Name="BFILE">

</Keyword>
<Keyword Name="BITMAP">

</Keyword>
<Keyword Name="BLOB">

</Keyword>
<Keyword Name="BLOCK">

</Keyword>
<Keyword Name="BODY">

</Keyword>
<Keyword Name="BY">

</Keyword>
<Keyword Name="CACHE">

</Keyword>
<Keyword Name="CACHE_INSTANCES">

</Keyword>
<Keyword Name="CANCEL">

</Keyword>
<Keyword Name="CASCADE">

</Keyword>
<Keyword Name="CAST">

</Keyword>
<Keyword Name="CFILE">

</Keyword>
<Keyword Name="CHAINED">

</Keyword>
<Keyword Name="CHANGE">

</Keyword>
<Keyword Name="CHAR">

</Keyword>
<Keyword Name="CHAR_CS">

</Keyword>
<Keyword Name="CHARACTER">

</Keyword>
<Keyword Name="CHECK">

</Keyword>
<Keyword Name="CHECKPOINT">

</Keyword>
<Keyword Name="CHOOSE">

</Keyword>
<Keyword Name="CHUNK">

</Keyword>
<Keyword Name="CLEAR">

</Keyword>
<Keyword Name="CLOB">

</Keyword>
<Keyword Name="CLONE">

</Keyword>
<Keyword Name="CLOSE">

</Keyword>
<Keyword Name="CLOSE_CACHED_OPEN_CURSORS">

</Keyword>
<Keyword Name="CLUSTER">

</Keyword>
<Keyword Name="COALESCE">

</Keyword>
<Keyword Name="COLUMN">

</Keyword>
<Keyword Name="COLUMNS">

</Keyword>
<Keyword Name="COMMENT">

</Keyword>
<Keyword Name="COMMIT">

</Keyword>
<Keyword Name="COMMITTED">

</Keyword>
<Keyword Name="COMPATIBILITY">

</Keyword>
<Keyword Name="COMPILE">

</Keyword>
<Keyword Name="COMPLETE">

</Keyword>
<Keyword Name="COMPOSITE_LIMIT">

</Keyword>
<Keyword Name="COMPRESS">

</Keyword>
<Keyword Name="COMPUTE">

</Keyword>
<Keyword Name="CONNECT">

</Keyword>
<Keyword Name="CONNECT_TIME">

</Keyword>
<Keyword Name="CONSTRAINT">

</Keyword>
<Keyword Name="CONSTRAINTS">

</Keyword>
<Keyword Name="CONTENTS">

</Keyword>
<Keyword Name="CONTINUE">

</Keyword>
<Keyword Name="CONTROLFILE">

</Keyword>
<Keyword Name="CONVERT">

</Keyword>
<Keyword Name="COST">

</Keyword>
<Keyword Name="CPU_PER_CALL">

</Keyword>
<Keyword Name="CPU_PER_SESSION">

</Keyword>
<Keyword Name="CREATE">

</Keyword>
<Keyword Name="CURREN_USER">

</Keyword>
<Keyword Name="CURRENT">

</Keyword>
<Keyword Name="CURRENT_SCHEMA">

</Keyword>
<Keyword Name="CURSOR">

</Keyword>
<Keyword Name="CYCLE">

</Keyword>
<Keyword Name="DANGLING">

</Keyword>
<Keyword Name="DATABASE">

</Keyword>
<Keyword Name="DATAFILE">

</Keyword>
<Keyword Name="DATAFILES">

</Keyword>
<Keyword Name="DATAOBJNO">

</Keyword>
<Keyword Name="DATE">

</Keyword>
<Keyword Name="DBA">

</Keyword>
<Keyword Name="DBHIGH">

</Keyword>
<Keyword Name="DBLOW">

</Keyword>
<Keyword Name="DBMAC">

</Keyword>
<Keyword Name="DEALLOCATE">

</Keyword>
<Keyword Name="DEBUG">

</Keyword>
<Keyword Name="DEC">

</Keyword>
<Keyword Name="DECIMAL">

</Keyword>
<Keyword Name="DECLARE">

</Keyword>
<Keyword Name="DEFAULT">

</Keyword>
<Keyword Name="DEFERRABLE">

</Keyword>
<Keyword Name="DEFERRED">

</Keyword>
<Keyword Name="DEGREE">

</Keyword>
<Keyword Name="DELETE">

</Keyword>
<Keyword Name="DEREF">

</Keyword>
<Keyword Name="DESC">

</Keyword>
<Keyword Name="DIRECTORY">

</Keyword>
<Keyword Name="DISABLE">

</Keyword>
<Keyword Name="DISCONNECT">

</Keyword>
<Keyword Name="DISMOUNT">

</Keyword>
<Keyword Name="DISTINCT">

</Keyword>
<Keyword Name="DISTRIBUTED">

</Keyword>
<Keyword Name="DML">

</Keyword>
<Keyword Name="DOUBLE">

</Keyword>
<Keyword Name="DROP">

</Keyword>
<Keyword Name="DUMP">

</Keyword>
<Keyword Name="EACH">

</Keyword>
<Keyword Name="ELSE">

</Keyword>
<Keyword Name="ENABLE">

</Keyword>
<Keyword Name="END">

</Keyword>
<Keyword Name="ENFORCE">

</Keyword>
<Keyword Name="ENTRY">

</Keyword>
<Keyword Name="ESCAPE">

</Keyword>
<Keyword Name="EXCEPT">

</Keyword>
<Keyword Name="EXCEPTIONS">

</Keyword>
<Keyword Name="EXCHANGE">

</Keyword>
<Keyword Name="EXCLUDING">

</Keyword>
<Keyword Name="EXCLUSIVE">

</Keyword>
<Keyword Name="EXECUTE">

</Keyword>
<Keyword Name="EXISTS">

</Keyword>
<Keyword Name="EXPIRE">

</Keyword>
<Keyword Name="EXPLAIN">

</Keyword>
<Keyword Name="EXTENT">

</Keyword>
<Keyword Name="EXTENTS">

</Keyword>
<Keyword Name="EXTERNALLY">

</Keyword>
<Keyword Name="FAILED_LOGIN_ATTEMPTS">

</Keyword>
<Keyword Name="FAST">

</Keyword>
<Keyword Name="FILE">

</Keyword>
<Keyword Name="FIRST_ROWS">

</Keyword>
<Keyword Name="FLAGGER">

</Keyword>
<Keyword Name="FLOAT">

</Keyword>
<Keyword Name="FLOB">

</Keyword>
<Keyword Name="FLUSH">

</Keyword>
<Keyword Name="FOR">

</Keyword>
<Keyword Name="FORCE">

</Keyword>
<Keyword Name="FOREIGN">

</Keyword>
<Keyword Name="FREELIST">

</Keyword>
<Keyword Name="FREELISTS">

</Keyword>
<Keyword Name="FROM">

</Keyword>
<Keyword Name="FULL">

</Keyword>
<Keyword Name="FUNCTION">

</Keyword>
<Keyword Name="GLOBAL">

</Keyword>
<Keyword Name="GLOBAL_NAME">

</Keyword>
<Keyword Name="GLOBALLY">

</Keyword>
<Keyword Name="GRANT">

</Keyword>
<Keyword Name="GROUP">

</Keyword>
<Keyword Name="GROUPS">

</Keyword>
<Keyword Name="HASH">

</Keyword>
<Keyword Name="HASHKEYS">

</Keyword>
<Keyword Name="HAVING">

</Keyword>
<Keyword Name="HEADER">

</Keyword>
<Keyword Name="HEAP">

</Keyword>
<Keyword Name="IDENTIFIED">

</Keyword>
<Keyword Name="IDGENERATORS">

</Keyword>
<Keyword Name="IDLE_TIME">

</Keyword>
<Keyword Name="IF">

</Keyword>
<Keyword Name="IMMEDIATE">

</Keyword>
<Keyword Name="IN">

</Keyword>
<Keyword Name="INCLUDING">

</Keyword>
<Keyword Name="INCREMENT">

</Keyword>
<Keyword Name="IND_PARTITION">

</Keyword>
<Keyword Name="INDEX">

</Keyword>
<Keyword Name="INDEXED">

</Keyword>
<Keyword Name="INDEXES">

</Keyword>
<Keyword Name="INDICATOR">

</Keyword>
<Keyword Name="INITIAL">

</Keyword>
<Keyword Name="INITIALLY">

</Keyword>
<Keyword Name="INITRANS">

</Keyword>
<Keyword Name="INSERT">

</Keyword>
<Keyword Name="INSTANCE">

</Keyword>
<Keyword Name="INSTANCES">

</Keyword>
<Keyword Name="INSTEAD">

</Keyword>
<Keyword Name="INT">

</Keyword>
<Keyword Name="INTEGER">

</Keyword>
<Keyword Name="INTERMEDIATE">

</Keyword>
<Keyword Name="INTERSECT">

</Keyword>
<Keyword Name="INTO">

</Keyword>
<Keyword Name="IS">

</Keyword>
<Keyword Name="ISOLATION">

</Keyword>
<Keyword Name="ISOLATION_LEVEL">

</Keyword>
<Keyword Name="KEEP">

</Keyword>
<Keyword Name="KEY">

</Keyword>
<Keyword Name="KILL">

</Keyword>
<Keyword Name="LABEL">

</Keyword>
<Keyword Name="LAYER">

</Keyword>
<Keyword Name="LESS">

</Keyword>
<Keyword Name="LEVEL">

</Keyword>
<Keyword Name="LIBRARY">

</Keyword>
<Keyword Name="LIKE">

</Keyword>
<Keyword Name="LIMIT">

</Keyword>
<Keyword Name="LINK">

</Keyword>
<Keyword Name="LIST">

</Keyword>
<Keyword Name="LOB">

</Keyword>
<Keyword Name="LOCAL">

</Keyword>
<Keyword Name="LOCK">

</Keyword>
<Keyword Name="LOCKED">

</Keyword>
<Keyword Name="LOG">

</Keyword>
<Keyword Name="LOGFILE">

</Keyword>
<Keyword Name="LOGGING">

</Keyword>
<Keyword Name="LOGICAL_READS_PER_CALL">

</Keyword>
<Keyword Name="LOGICAL_READS_PER_SESSION">

</Keyword>
<Keyword Name="LONG">

</Keyword>
<Keyword Name="MANAGE">

</Keyword>
<Keyword Name="MASTER">

</Keyword>
<Keyword Name="MAX">

</Keyword>
<Keyword Name="MAXARCHLOGS">

</Keyword>
<Keyword Name="MAXDATAFILES">

</Keyword>
<Keyword Name="MAXEXTENTS">

</Keyword>
<Keyword Name="MAXINSTANCES">

</Keyword>
<Keyword Name="MAXLOGFILES">

</Keyword>
<Keyword Name="MAXLOGHISTORY">

</Keyword>
<Keyword Name="MAXLOGMEMBERS">

</Keyword>
<Keyword Name="MAXSIZE">

</Keyword>
<Keyword Name="MAXTRANS">

</Keyword>
<Keyword Name="MAXVALUE">

</Keyword>
<Keyword Name="MEMBER">

</Keyword>
<Keyword Name="MIN">

</Keyword>
<Keyword Name="MINEXTENTS">

</Keyword>
<Keyword Name="MINIMUM">

</Keyword>
<Keyword Name="MINUS">

</Keyword>
<Keyword Name="MINVALUE">

</Keyword>
<Keyword Name="MLS_LABEL_FORMAT">

</Keyword>
<Keyword Name="MLSLABEL">

</Keyword>
<Keyword Name="MODE">

</Keyword>
<Keyword Name="MODIFY">

</Keyword>
<Keyword Name="MOUNT">

</Keyword>
<Keyword Name="MOVE">

</Keyword>
<Keyword Name="MTS_DISPATCHERS">

</Keyword>
<Keyword Name="MULTISET">

</Keyword>
<Keyword Name="NATIONAL">

</Keyword>